In una carreggiata del tipo rappresentato si può sorpassare anche in curva,V
La carreggiata del tipo rappresentato è a doppio senso di circolazione,V
"In una carreggiata extraurbana del tipo rappresentato le corsie interne sono, di norma, riservate al sorpasso",V
In una carreggiata del tipo rappresentato non si può effettuare l'inversione di marcia,V
In una carreggiata extraurbana del tipo rappresentato si può sorpassare indifferentemente sia da destra che da sinistra,F
In una carreggiata extraurbana del tipo rappresentato si può sempre marciare per file parallele,F
In una carreggiata del tipo rappresentato possiamo iniziare un sorpasso anche se il conducente che sta dietro ha già iniziato la stessa manovra,F
"Nella strada rappresentata, per ogni senso di marcia, la corsia di destra è, di norma, dedicata alla marcia ordinaria",V
La strada rappresentata è composta da tre corsie per ogni senso di marcia,V
"Nella strada rappresentata, per ogni senso di marcia, le corsie di centro e di sinistra sono dedicate, di norma, al sorpasso",V
La strada rappresentata è composta da una carreggiata,V
"Nella strada rappresentata, per ogni senso di marcia, la corsia di centro è dedicata, di norma, alla marcia ordinaria",F
"Nella strada rappresentata, per ogni senso di marcia, la corsia di destra è dedicata, di norma, al sorpasso",F
La strada rappresentata è composta da due carreggiate,F
"Nella strada rappresentata, per ogni senso di marcia, la corsia di sinistra è dedicata, di norma, alla marcia ordinaria",F
La strada rappresentata è composta da tre carreggiate,V
La strada rappresentata è composta da otto corsie,V
"Nella strada rappresentata le carreggiate laterali sono, di norma, a senso unico",V
"Nella strada rappresentata la carreggiata centrale è, di norma, a doppio senso di circolazione",V
"La strada rappresentata consente, di norma, il sorpasso anche in curva",V
"La strada rappresentata è composta da quattro carreggiate, tutte a senso unico",F
La strada rappresentata è composta da otto carreggiate,F
"La strada rappresentata, di norma, ha due carreggiate a doppio senso di circolazione",F
La strada rappresentata è composta da tre corsie,F
"Nella strada rappresentata, la corsia centrale è a doppio senso di circolazione",F
"Nelle carreggiate laterali della strada rappresentata è consentita, di norma, l'inversione di marcia",F
L'attraversamento pedonale viene segnalato con strisce bianche parallele,V
L'attraversamento pedonale è una parte della carreggiata sulla quale è vietata la fermata dei veicoli,V
"L'attraversamento pedonale è una parte della carreggiata, in cui i veicoli devono dare la precedenza ai pedoni, che attraversano sulle apposite strisce",V
L'attraversamento pedonale è una parte della carreggiata destinata al transito dei pedoni che attraversano,V
L'attraversamento pedonale è una parte della carreggiata sulla quale è vietata la sosta dei veicoli,V
"L'attraversamento pedonale è una parte della strada, separata dalla carreggiata mediante una striscia gialla",F
L'attraversamento pedonale è una parte della carreggiata vietata al transito dei veicoli,F
L'attraversamento pedonale non fa parte della carreggiata,F
L'attraversamento pedonale è posto al di fuori della carreggiata ed è destinato al transito dei pedoni,F
L'attraversamento pedonale è una parte della carreggiata in cui è consentita la fermata ma non la sosta dei veicoli,F
Le strade extraurbane principali sono a carreggiate separate,V
Le strade extraurbane principali sono dotate di apposite aree di sosta,V
La strada extraurbana principale non ha incroci a raso che l'attraversano,V
Le strade extraurbane principali sono segnalate da cartelli stradali di inizio e fine,V
Nelle strade extraurbane principali possono circolare solo alcune categorie di veicoli a motore,V
Nelle strade extraurbane principali si possono trovare intersezioni (incroci) a livelli sfalsati,V
Le strade extraurbane principali sono provviste di corsie di accelerazione per l'ingresso,V
Sulle strade extraurbane principali è consentito circolare alla velocità massima di 130 km/h,F
Le strade extraurbane principali sono contraddistinte da segnaletica verde,F
Le strade extraurbane principali possono essere ad un'unica carreggiata,F
Sulle strade extraurbane principali è consentito circolare alla stessa velocità massima prevista per le autostrade,F
Sulle strade extraurbane principali i quadricicli leggeri possono transitare,F
Le strade extraurbane principali hanno una sola corsia per ogni senso di marcia,F
Sulle strade extraurbane principali i ciclomotori possono transitare,F
Nelle strade extraurbane principali non vi sono curve né dossi,F
Le strade extraurbane principali devono essere dotate di pannelli a messaggio variabile,F
L'isola di traffico serve a facilitare l'incanalamento dei veicoli verso varie direzioni,V
L'isola di traffico è delimitata da strisce bianche continue,V
L'isola di traffico può essere a raso o in rilievo (rialzata),V
L'isola di traffico viene evidenziata mediante zebrature di colore bianco,V
L'isola di traffico è una parte della strada sulla quale è vietato il transito dei motocicli,V
L'isola di traffico a raso è costituita da zebrature di colore bianco,V
"L'isola di traffico, se rialzata, è preceduta da zebrature di colore bianco",V
L'isola di traffico è una parte della strada sulla quale è vietato il transito dei veicoli,V
L'isola di traffico serve a separare la carreggiata dalla banchina,F
L'isola di traffico serve per il transito dei pedoni,F
L'isola di traffico è una piazzola di sosta per i veicoli,F
L'isola di traffico può essere percorsa solo dai taxi e dagli autobus urbani,F
L'isola di traffico è la parte della città con maggiore traffico,F
"L'isola di traffico corrisponde, in genere, al centro storico della città",F
L'isola di traffico è una piazzola per effettuare l'inversione di marcia,F
L'isola di traffico è posta al di fuori della strada,F
L'isola di traffico serve per la fermata dei veicoli,F
"L'isola di traffico facilita la salita e la discesa di passeggeri da tram, filobus e autobus",F
L'isola di traffico è una zona destinata al parcheggio dei veicoli,F
L'isola di traffico è un'area pedonale urbana,F
L'isola di traffico è una parte della strada sulla quale è consentito il transito dei ciclomotori,F
L'intersezione (incrocio) a livelli sfalsati comprende strade situate ad altezze diverse,V
"L'intersezione (incrocio) a livelli sfalsati facilita la circolazione, perché esclude l'incrocio diretto fra i veicoli",V
"L'intersezione (incrocio) a livelli sfalsati comprende rampe, sovrappassi o sottopassi",V
"L'intersezione (incrocio) a livelli sfalsati è munita di infrastrutture (rampe, sovrappassi, sottopassi) per il collegamento fra strade poste a livelli diversi",V
L'intersezione a livelli sfalsati è un incrocio a raso fra una strada e i binari del treno,F
Nell'intersezione (incrocio) a livelli sfalsati non valgono i limiti massimi generali di velocità,F
"L'intersezione (incrocio) a livelli sfalsati è, di norma, regolata da semafori",F
Nell'intersezione (incrocio) a raso due o più strade si incrociano allo stesso livello,V
L'intersezione (incrocio) a raso può essere regolata da semaforo,V
L'intersezione (incrocio) a raso è un'intersezione di due o più strade poste allo stesso livello,V
L'intersezione (incrocio) a raso richiede di fare attenzione ai veicoli provenienti dalle strade che si incrociano,V
L'intersezione (incrocio) a raso è un incrocio fra una strada statale e i binari del tram,F
L'intersezione (incrocio) a raso è un passaggio a livello dotato di barriere o semibarriere,F
L'intersezione (incrocio) a raso è un'intersezione a livelli sfalsati,F
"L'intersezione (incrocio) a raso è un insieme di sovrappassi, sottopassi e rampe",F
L'intersezione (incrocio) a raso è un incrocio fra una strada statale e un passo carrabile,F
Una zona a traffico limitato è un'area in cui può essere limitata la circolazione dei veicoli solo in alcune ore,V
Una zona a traffico limitato è un'area nella quale può essere limitata la circolazione solo di particolari categorie di veicoli,V
In una zona a traffico limitato possono circolare solo i veicoli autorizzati,V
Una zona a traffico limitato è un'area nella quale può essere limitata la circolazione solo a particolari categorie di utenti,V
Una zona a traffico limitato è delimitata da appositi segnali stradali di inizio e di fine,V
In una zona a traffico limitato non possono entrare più di un certo numero di veicoli,F
Una zona a traffico limitato è un'area nella quale è consentito solo il transito di ciclomotori e biciclette,F
Una zona a traffico limitato è un'area sempre vietata al transito dei veicoli a motore,F
Una zona a traffico limitato è un'area vietata al transito dei pedoni durante le ore notturne,F
In un passaggio a livello si possono trovare le barriere,V
In un passaggio a livello si possono trovare le semibarriere,V
In un passaggio a livello si possono trovare le luci rosse,V
In vicinanza di un passaggio a livello si trovano i pannelli distanziometrici,V
In un passaggio a livello si può trovare la croce di S. Andrea,V
In un passaggio a livello si può trovare un dispositivo di segnalazione acustica,V
Il passaggio a livello è un cavalcavia ferroviario o tranviario,F
In un passaggio a livello si possono trovare le luci gialle lampeggianti,F
Il passaggio a livello è caratterizzato dalla presenza di un attraversamento autostradale,F
In un passaggio a livello si possono trovare le corsie di accelerazione,F
Il passaggio a livello è un passo carrabile,F
Il passaggio a livello è caratterizzato dalla presenza di un sottopassaggio,F
"Nelle aree pedonali possono transitare i veicoli ad emissione zero (elettrici), se espressamente consentito",V
Nelle aree pedonali possono transitare i pedoni,V
Nelle aree pedonali possono transitare le biciclette,V
Nelle aree pedonali possono transitare i veicoli al servizio di persone diversamente abili,V
"Nelle aree pedonali possono transitare i veicoli della polizia, con sirena e luce lampeggiante blu in funzione",V
"Nelle aree pedonali possono transitare gli autoveicoli dei vigili del fuoco, con luce lampeggiante blu e sirena in funzione",V
"Nelle aree pedonali possono transitare tutti i motocicli, purché diano la precedenza ai pedoni",F
"Nelle aree pedonali possono transitare i trattori stradali, con velocità non superiore a 30 km/h",F
Nelle aree pedonali i ciclomotori possono transitare solo di giorno,F
"Nelle aree pedonali possono transitare tutti gli autoveicoli, ma con prudenza",F
"Nelle aree pedonali possono transitare i quadricicli a motore, purché non superino la velocità di 50 km/h",F
La strada può essere suddivisa in carreggiate,V
La strada può comprendere le piste ciclabili,V
La strada può essere a senso unico di circolazione,V
La strada può essere a doppio senso di circolazione,V
"La strada è aperta alla circolazione dei pedoni, degli animali e dei veicoli",V
La strada non comprende le banchine,F
La strada è riservata alla circolazione dei soli autoveicoli e motocicli,F
La strada è normalmente riservata alla circolazione dei soli veicoli e animali,F
La strada non comprende i marciapiedi,F
"La strada è qualsiasi area asfaltata, limitata lateralmente dagli attraversamenti pedonali",F
L'autostrada non ha incroci a raso che l'attraversano,V
L'autostrada è dotata di speciali corsie per l'ingresso e l'uscita dei veicoli,V
L'autostrada è a carreggiate indipendenti o separate da spartitraffico,V
I motocicli con cilindrata di almeno 150 cm3 possono circolare in autostrada,V
Le macchine agricole non possono circolare in autostrada,V
Non tutti i tipi di veicoli possono circolare in autostrada,V
L'uscita dei veicoli dalle autostrade avviene tramite corsie di decelerazione,V
L'autostrada deve essere lateralmente recintata,V
Nelle autostrade possono circolare solo le autovetture,F
Nelle autostrade possono circolare tutti i tipi di motocicli,F
L'autostrada può comprendere piste ciclabili,F
Nelle autostrade possono circolare i ciclomotori e i motocicli con cilindrata fino a 125 cm3,F
Nelle autostrade possono circolare solo gli autoveicoli,F
Nelle autostrade possono circolare tutti i motocicli e i ciclomotori,F
La carreggiata può essere a senso unico di circolazione,V
La carreggiata può essere a doppio senso di circolazione,V
La carreggiata può essere suddivisa in corsie,V
La carreggiata non comprende le piste ciclabili,V
La carreggiata non comprende i marciapiedi,V
La carreggiata è la parte della strada destinata normalmente alla circolazione dei veicoli,V
La carreggiata è destinata soltanto alla circolazione di carri a trazione animale,F
La carreggiata è destinata alla sosta di emergenza,F
La carreggiata è destinata alla sosta degli autocarri,F
La carreggiata è la traccia lasciata dalle ruote dei veicoli sulle strade innevate,F
La carreggiata comprende le piazzole di sosta,F
Fanno parte della carreggiata le corsie di marcia,V
Fanno parte della carreggiata gli attraversamenti ciclabili,V
Fanno parte della carreggiata gli attraversamenti pedonali,V
Fanno parte della carreggiata le corsie di sorpasso,V
Fanno parte della carreggiata le corsie di emergenza delle autostrade,F
Fanno parte della carreggiata le banchine,F
Fanno parte della carreggiata i marciapiedi,F
La corsia può essere destinata alla normale marcia dei veicoli,V
La corsia è limitata da strisce continue o discontinue,V
La corsia può essere di accelerazione,V
La corsia può essere di decelerazione,V
Le corsie possono essere vietate a taluni tipi di veicoli,V
"La corsia può essere riservata alla circolazione di alcune categorie di veicoli (taxi, autobus, ecc.)",V
La corsia può essere destinata ad effettuare sorpassi,V
L'ente proprietario della strada può imporre che su una corsia i veicoli transitino ad una velocità minima obbligatoria,V
La corsia è una parte della carreggiata che consente la circolazione di una sola fila di veicoli,V
"La corsia può essere destinata alle soste di emergenza, in caso di guasto o malessere",V
La corsia può essere riservata ai veicoli che intendono svoltare (corsia specializzata),V
La corsia può essere destinata al rallentamento dei veicoli in uscita dalle autostrade,V
La corsia è destinata solo al transito dei pedoni,F
La corsia può essere a doppio senso di circolazione,F
La corsia è una pista riservata alle vetture da corsa,F
La corsia non può mai essere attraversata dai pedoni,F
La corsia è formata da due carreggiate,F
La corsia è una strada a scorrimento veloce,F
"Nei centri abitati, su una stessa corsia possono circolare affiancati due motocicli",F
"Fuori dai centri abitati, su una stessa corsia possono circolare affiancati due ciclomotori",F
La corsia di accelerazione facilita l'ingresso dei veicoli in autostrada o su strade extraurbane principali,V
La corsia di accelerazione serve ad entrare correttamente in autostrada,V
La corsia di accelerazione viene utilizzata per aumentare la velocità,V
La corsia di accelerazione serve per rientrare sulla carreggiata dell’autostrada dopo che si è usciti da un’area di servizio,V
La corsia di accelerazione può essere utilizzata per il sorpasso,F
La corsia di accelerazione serve per uscire da una piazzola di sosta,F
La corsia di accelerazione serve per abbandonare la carreggiata dell’autostrada ed entrare in un’area di sosta,F
La corsia di decelerazione facilita l'uscita dei veicoli dall'autostrada,V
La corsia di decelerazione serve per uscire correttamente da una strada extraurbana principale,V
La corsia di decelerazione serve per uscire dalla carreggiata dell’autostrada ed entrare nell’area di servizio,V
La corsia di decelerazione può essere utilizzata per la sosta dei veicoli,F
La corsia di decelerazione serve per entrare in una piazzola di sosta,F
La corsia di decelerazione serve ad entrare in autostrada,F
"La banchina non consente, di norma, il transito ai veicoli",V
"La banchina è parte della strada, posta al di fuori della carreggiata",V
"La banchina è parte della strada, situata oltre la linea bianca continua di margine della carreggiata",V
"La banchina è riservata ai veicoli lenti, nelle strade in salita",F
Sulle banchine la sosta dei veicoli è consentita per un massimo di 5 ore,F
La banchina divide la carreggiata in due corsie,F
"La banchina è parte della carreggiata, destinata alla sosta dei veicoli",F
"Il marciapiede è una parte della strada, rialzata o delimitata in altro modo, riservata ai pedoni",V
"Il marciapiede è una parte della strada riservata, di norma, ai pedoni",V
Il marciapiede consente la sosta dei veicoli solo in presenza di apposite strisce di parcheggio,V
"Il marciapiede è una parte della strada, al di fuori della carreggiata, destinata alla circolazione dei pedoni",V
Il marciapiede è una parte della carreggiata,F
Il marciapiede è una parte della strada riservata anche alle biciclette,F
"Il marciapiede è riservato ai pedoni e ai veicoli in sosta, qualora non sia rialzato",F
"Il marciapiede è una parte della strada dove, di norma, è consentita la sosta dei ciclomotori",F
"l salvagente, posto in corrispondenza di attraversamenti pedonali, serve anche al riparo o alla sosta dei pedoni che attraversano la strada",V
"Il salvagente facilita la salita e la discesa dei passeggeri da tram, filobus o autobus",V
Il salvagente può essere segnalato da colonnine luminose a luce gialla fissa,V
Il salvagente serve a dividere i sensi di marcia in una strada a doppio senso di circolazione,F
Il salvagente serve a incanalare i veicoli in varie direzioni,F
Il salvagente è una persona preposta al primo soccorso,F
Il salvagente è un itinerario ciclopedonale,F
"Il passo carrabile consente ai veicoli di accedere alle proprietà private laterali alla strada (garage, cortili, ecc.)",V
Il passo carrabile permette ai veicoli che circolano su una strada pubblica di accedere ad un'area laterale adibita alla sosta,V
"Il passo carrabile deve essere corredato da apposito segnale, che riporti l'ente e il numero di autorizzazione",V
Il passo carrabile è una zona per l’accesso dei veicoli alle proprietà laterali alla strada,V
In corrispondenza del passo carrabile è consentita la fermata,V
Il passo carrabile è un parcheggio scambiatore,F
Il passo carrabile è una strada riservata ai carri trainati da animali,F
Il passo carrabile è una strada riservata agli autocarri,F
Il passo carrabile è un salvagente circolare per i pedoni,F
Il passo carrabile è un segnale che impone la circolazione rotatoria su una piazza,F
In corrispondenza del passo carrabile è consentita la sosta,F
"I veicoli a due ruote, con motore termico fino a 50 cm3 di cilindrata e velocità massima di 45 km/h sono ciclomotori",V
I ciclomotori possono avere due o tre ruote,V
Non tutti i veicoli a motore a due ruote vengono classificati ciclomotori,V
I ciclomotori a due ruote non possono avere un motore termico di cilindrata superiore a 50 cm3,V
"I ciclomotori sono soggetti a revisione dopo quattro anni dalla prima immatricolazione, successivamente ogni due anni",V
I ciclomotori non hanno più di due ruote,F
"Le biciclette con pedalata assistita, dotate di motore elettrico ausiliario di potenza massima fino a 0,25 kW, sono definite ciclomotori",F
Si definiscono ciclomotori tutti i veicoli a due ruote di cilindrata superiore a 50 cm3,F
"I ciclomotori, per essere definiti tali, devono essere muniti di cambio manuale",F
I ciclomotori possono circolare alla velocità di 60 km/h fuori dai centri urbani,F
I ciclomotori non sono soggetti a revisione periodica,F
I tricicli a motore sono veicoli a motore a tre ruote simmetriche,V
I tricicli a motore sono veicoli con motore di cilindrata superiore a 50 cm3,V
I tricicli a motore sono veicoli a motore aventi una velocità massima per costruzione superiore a 45 km/h,V
"I tricicli a motore sono soggetti a revisione dopo quattro anni dalla prima immatricolazione, successivamente ogni due anni",V
I tricicli a motore sono veicoli a motore che possono essere condotti senza patente,F
I tricicli a motore sono costituiti da un motociclo e un sidecar,F
I tricicli a motore sono veicoli con motore di cilindrata inferiore a 50 cm3 e aventi velocità massima per costruzione fino a 45 km/h,F
I tricicli a motore non sono soggetti a revisione periodica,F
quadricicli leggeri alimentati a benzina hanno cilindrata del motore inferiore o pari a 50 cm3,V
I quadricicli sono veicoli a motore a quattro ruote,V
"I quadricicli leggeri, ai fini della circolazione, sono assimilati ai ciclomotori",V
La potenza dei quadricicli non leggeri è sempre inferiore o uguale a 15 kW,V
I quadricicli sono soggetti a revisione periodica,V
I quadricicli diversi da quelli leggeri possono essere guidati senza patente,F
"I quadricicli non leggeri, ai fini della circolazione, sono equiparati ai ciclomotori",F
"E' consentito sostituire il dispositivo di scarico dei quadricicli leggeri per aumentare la velocità massima, purché non si aumenti la cilindrata del motore",F
La guida dei quadricicli non leggeri è consentita già al compimento del quattordicesimo anno di età,F
I quadricicli non leggeri a manubrio e con carrozzeria aperta possono essere condotti senza casco,F
E' consentito aumentare la cilindrata dei quadricicli leggeri purché non si aumenti la velocità,F
E' consentito sostituire il motore del quadriciclo leggero per aumentare la velocità massima oltre i 45 km/h,F
I quadricicli non sono soggetti a revisione periodica,F
Le macchine agricole possono circolare su strada per il proprio trasferimento se immatricolate,V
Le macchine agricole possono essere a ruote o a cingoli,V
Le macchine agricole a ruote o a cingoli possono circolare su strada per il trasporto di prodotti agricoli per conto delle aziende agricole e forestali,V
Le macchine agricole possono essere semoventi o trainate,V
Le macchine agricole operatrici possono essere dotate di speciali attrezzature per l'esecuzione di operazioni agricole,V
Le macchine operatrici possono essere semoventi o trainate,V
Le macchine operatrici possono essere veicoli sgombraneve,V
Le macchine operatrici possono circolare ad una velocità superiore a 50 km/h,F
Le macchine operatrici a cingoli possono circolare ad una velocità superiore a 45 km/h,F
Le macchine operatrici semoventi possono trasportare fino a quattro passeggeri,F
Per condurre macchine operatrici è necessario essere titolari della patente di guida della categoria A,F
Le macchine agricole possono trasportare fino a quattro passeggeri,F
Sulle macchine agricole e sui loro rimorchi è consentito il trasporto di persone in piedi,F
Con la patente di categoria A si possono guidare tutte le macchine agricole,F
Con la patente di categoria B si possono guidare le macchine operatrici eccezionali,F
I caravan (roulottes) sono rimorchi attrezzati per essere adibiti ad alloggio,V
I caravan (roulottes) sono utilizzabili come alloggio solo con veicolo fermo,V
I caravan (roulottes) sono muniti di targa,V
E' possibile alloggiare nei caravan (roulottes) durante la circolazione,F
I caravan (roulottes) sono rimorchi destinati ai lavori agricoli,F
I caravan (roulottes) sono rimorchi destinati esclusivamente al trasporto di attrezzature turistiche e sportive,F
Le autocaravan (camper) sono veicoli aventi una speciale carrozzeria per essere adibiti al trasporto ed all'alloggio di persone,V
Le autocaravan (camper) sono veicoli aventi una speciale carrozzeria per essere adibiti al trasporto ed all'alloggio al massimo del numero di persone indicato nella carta di circolazione,V
Le autocaravan (camper) sono veicoli attrezzati permanentemente per essere adibiti al trasporto ed all'alloggio di persone,V
Le autocaravan sono soggette a revisione periodica,V
Le autocaravan (camper) sono rimorchi,F
Le autocaravan (camper) sono veicoli destinati ai lavori agricoli,F
Le autocaravan (camper) sono veicoli destinati alla costruzione e alla manutenzione di opere stradali,F
"Sulle autocaravan (camper) è possibile viaggiare in piedi, solo per brevi tratti",F
Le autocaravan sono soggette a revisione ogni cinque anni,F
"Durante la circolazione, gli autocarri con massa massima a pieno carico superiore a 3,5 tonnellate devono essere segnalati posteriormente con pannelli retroriflettenti in figura",V
"Durante la circolazione, i rimorchi e i semirimorchi per trasporto di cose con massa massima a pieno carico superiore a 3,5 tonnellate devono essere segnalati posteriormente con pannelli retroriflettenti in figura",V
"Durante la circolazione, gli autocarri ed i rimorchi con massa massima a pieno carico superiore a 3,5 t devono essere segnalati con strisce posteriori e laterali retroriflettenti",V
Il pannello in figura segnala il trasporto di merci pericolose,V
Il pannello in figura segnala il trasporto di carichi sporgenti,V
Le strisce retroriflettenti applicate lateralmente ad alcuni veicoli possono essere di colore bianco o giallo,V
Le strisce retroriflettenti applicate dietro ad alcuni veicoli possono essere di colore rosso o giallo,V
"Il conducente che vede i pannelli in figura sta seguendo un autocarro con massa a pieno carico superiore a 3,5 tonnellate",V
"Il conducente che vede i pannelli in figura sta seguendo un rimorchio o semirimorchio per trasporto di cose con massa a pieno carico superiore a 3,5 tonnellate",V
"Le strisce retroriflettenti laterali devono essere apposte sugli autocarri di massa complessiva a pieno carico inferiore a 3,5 tonnellate",F
"Durante la circolazione, gli autocarri di massa complessiva a pieno carico inferiore o uguale a 3,5 tonnellate devono essere segnalati posteriormente con pannelli retroriflettenti gialli e rossi",F
