Nella parte posteriore degli autobus deve essere apposto un segnale che indica la velocità minima consentita,F
Nella parte posteriore delle autovetture deve essere apposto un segnale che indica la velocità massima consentita,F
I caravan (roulottes) devono essere muniti posteriormente di strisce retroriflettenti di colore rosso o giallo,F
"Gli autobus devono essere muniti, nella parte posteriore di strisce retroriflettenti di colore rosso o bianco",F
"Il pannello in figura è installato posteriormente ai rimorchi o semirimorchi con massa a pieno carico superiore a 3,5 tonnellate",F
I motocicli sono veicoli a due ruote,V
I motocicli hanno cilindrata superiore a 50 cm3,V
I ciclomotori non rientrano nella categoria dei motocicli,V
I motocicli possono essere dotati di cambio automatico,V
"I motocicli sono soggetti a revisione dopo quattro anni dalla prima immatricolazione, successivamente ogni due anni",V
Tutti i veicoli a motore con tre ruote sono dei motocicli,F
I motocicli sono veicoli a motore con più di due ruote,F
Il motociclo è un qualunque veicolo a due ruote,F
Si definiscono motocicli solo i veicoli a due ruote di cilindrata fino a 125 cm3,F
I motocicli hanno motore di cilindrata fino a 50 cm3 e sviluppano una velocità fino a 45 km/h,F
Ai fini della circolazione i quadricicli leggeri sono assimilati ai motocicli,F
"Gli autoveicoli sono veicoli a motore con almeno quattro ruote, esclusi i quadricicli",V
"L'autoveicolo è un veicolo a motore con non meno di quattro ruote, eccetto i quadricicli",V
L'autobus viene classificato autoveicolo,V
L'autocarro è un autoveicolo,V
I quadricicli non sono autoveicoli,V
"Gli autoveicoli sono tutti i veicoli a motore con quattro o più ruote, compresi i quadricicli",F
Gli autoveicoli sono tutti i veicoli con almeno due ruote,F
"Gli autoveicoli sono tutti i veicoli con almeno quattro ruote, compresi quelli senza motore",F
Il triciclo a motore è un autoveicolo,F
L'autoveicolo è un qualunque veicolo a motore,F
L'autoveicolo è un qualunque veicolo adibito al trasporto di merce,F
"L'autovettura è un veicolo a motore con quattro ruote, destinato al trasporto di massimo nove persone, compreso il conducente",V
L'autovettura fa parte degli autoveicoli,V
"L'autovettura non può avere più di nove posti, compreso il conducente",V
L'autobus non è un'autovettura,V
Le autovetture possono avere motore elettrico,V
Le autovetture sono soggette a revisione periodica,V
Si definiscono autovetture tutti i veicoli a motore che hanno la trazione posteriore,F
Le autovetture non possono trainare carrelli-appendice o rimorchi,F
Vengono definite autovetture tutti i veicoli con motore anteriore,F
"L'autovettura è un veicolo con dieci posti in totale, compreso il conducente",F
Si definisce autovettura il veicolo blindato e appositamente attrezzato per il trasporto di valori,F
L'autocarro è un'autovettura,F
"L'autovettura può avere, al massimo, cinque posti",F
Le autovetture sono soggette a revisione ogni cinque anni,F
"I rimorchi o i semirimorchi sono veicoli privi di motore, destinati ad essere trainati",V
I rimorchi leggeri sono quelli di massa massima a pieno carico fino a 750 kg,V
L'autosnodato non è classificato rimorchio,V
L'autocaravan non è un rimorchio,V
Il caravan non è un rimorchio,F
I rimorchi leggeri sono quelli di massa massima a pieno carico fino a 500 kg,F
I semirimorchi sono rimorchi privi di impianto frenante,F
I rimorchi sono muniti di silenziatore,F
Bisogna lasciare liberi gli incroci in caso di traffico intenso,V
Bisogna lasciare liberi i passaggi a livello e i binari del tram anche in caso di traffico intenso,V
Bisogna lasciare liberi gli attraversamenti pedonali e quelli ciclabili in caso di formazione di code di veicoli,V
"Bisogna lasciare libere le immissioni stradali (incroci, confluenze, ingressi dei parcheggi, ecc.) anche in caso di traffico intenso",V
Bisogna lasciare liberi solo gli incroci regolati da semaforo in caso di formazione di code di veicoli,F
Bisogna lasciare liberi i cavalcavia in caso di traffico intenso,F
Bisogna lasciare libere le gallerie in caso di formazione di code di veicoli,F
Bisogna lasciare liberi gli ingressi delle abitazioni private in caso di formazione di code di veicoli,F
Bisogna lasciare liberi i sottovia in caso di traffico intenso,F
"Quando si viaggia in fila con altri veicoli, non bisogna limitarsi a osservare solamente il veicolo che precede, ma occorre porre attenzione anche in lontananza, per controllare la situazione del traffico",V
"Per agevolare il traffico, è opportuno lasciare liberi gli sbocchi delle strade laterali quando si viaggia dietro ad una fila di veicoli",V
"Quando si viaggia in fila con altri veicoli, bisogna mantenere ugualmente la distanza di sicurezza",V
"Per una maggiore sicurezza, quando si viaggia in fila con altri veicoli, è opportuno non avvicinarsi troppo al veicolo che precede",V
"Per una maggiore sicurezza, quando nei centri urbani si viaggia in fila con altri veicoli, è opportuno tenere sempre accese le luci di emergenza",F
Quando si viaggia in fila con altri veicoli è consentito distrarsi se si è a bassa velocità,F
"Quando si viaggia dietro in fila con altri veicoli, è opportuno spostarsi il più possibile a sinistra, per creare una corsia libera a destra",F
"Quando si viaggia in fila con altri veicoli, è opportuno spostarsi al centro della carreggiata, per controllare la situazione del traffico",F
"Anche in condizioni di scarsa visibilità quando si viaggia dietro ad un veicolo che solleva polvere, conviene sorpassarlo subito",F
Entrando in un centro abitato bisogna tenere conto che può cambiare spesso la precedenza agli incroci,V
"Entrando in un centro abitato, bisogna tenere conto che il flusso della circolazione viene spesso intralciato o interrotto da veicoli che sono fermi, che partono o che cambiano direzione",V
"Entrati in un centro abitato, bisogna tenere conto che gli altri utenti della strada (quali pedoni e ciclisti) si mescolano maggiormente con il traffico motorizzato",V
"In un centro abitato bisogna essere più attenti, prudenti e tolleranti, a causa del maggior numero di utenti che interagiscono nell'ambiente urbano",V
"Entrando in un centro abitato, bisogna continuare a mantenere la concentrazione alla guida anche se potrebbero aumentare i motivi per distrarsi",V
"Entrando in un centro abitato, bisogna considerare che è possibile sostare in corrispondenza di incroci non regolati",F
In un centro abitato è sempre consentita la marcia per file parallele,F
"In un centro abitato, bisogna considerare che i pedoni e i diversamente abili devono sempre dare la precedenza ai veicoli a motore",F
È vietato spostare o imbrattare la segnaletica stradale,V
È vietato rimuovere la segnaletica stradale,V
Spostare la segnaletica stradale può comportare pericolo grave per gli altri utenti della strada,V
"E' consentito spostare la segnaletica stradale, se non si tratta di segnali di pericolo",F
"E' consentito spostare la segnaletica stradale, dopo aver avvisato gli organi di polizia",F
"E' consentito spostare la segnaletica stradale, se si tratta delle barriere di delimitazione o dei coni stradali",F
Sulle strade è vietato gareggiare in velocità,V
Il conducente che partecipa a gare di velocità non autorizzate su aree pubbliche è punito con la reclusione,V
E' punito con la reclusione il conducente che gareggia in velocità su strade pubbliche,V
E' punito con la reclusione chi scommette su veicoli che partecipano a gare di velocità non autorizzate su strade pubbliche,V
Le competizioni sportive con veicoli su aree pubbliche sono consentite senza autorizzazione,F
"Sulle strade pubbliche sono consentite le gare di velocità, anche se non autorizzate, dalle ore 23.00 alle ore 6.00",F
"Sono consentite le gare di velocità, anche se non autorizzate, purché partecipino solo due autovetture",F
"Sulle strade pubbliche sono consentite le gare di velocità, anche se non autorizzate, tra motocicli e non tra autoveicoli",F
E' vietato lanciare dal finestrino mozziconi di sigaretta accesi,V
Gettare mozziconi di sigaretta accesi dai finestrini è molto pericoloso soprattutto se sopraggiungono veicoli a due ruote,V
Gettare mozziconi accesi dai finestrini in prossimità di boschi o aree verdi potrebbe causare incendi,V
E' vietato spargere fango o detriti sulle strade con le ruote sporche dei veicoli,V
Il conducente che si accorge che il suo veicolo perde olio deve compiere tutte le azioni necessarie per evitare pericoli per altri utenti,V
"Il conducente che si accorga che il suo veicolo ha forti perdite di olio o carburante, deve immediatamente avvisare l’ente proprietario della strada o gli organi di polizia",V
"Il conducente di veicolo a due ruote può circolare portando con sé un animale domestico, se custodito in apposita gabbia, purché non sia sporgente di oltre 50 centimetri.",V
Alla guida di un veicolo il conducente deve procedere a bassa velocità sopra le pozzanghere,V
"Se, uscendo da un sentiero fangoso, si sporca notevolmente la strada, si può incorrere in una sanzione amministrativa",V
"Per evitare di sporcare la carreggiata, bisogna pulire le ruote del veicolo, prima di uscire da un sentiero fangoso",V
"Uscendo da un sentiero fangoso o da un cantiere, bisogna assicurarsi che durante la marcia non cada terriccio che possa sporcare la strada",V
E' consentito spostare i segnali stradali verticali temporanei per parcheggiare il veicolo,F
E' consentito lanciare la carta dal finestrino,F
Il conducente può lanciare oggetti dal finestrino sulla banchina,F
Su una strada ricoperta da brecciolino il conducente può circolare a velocità sostenuta,F
Il conducente può superare i veicoli in coda accelerando bruscamente e cambiando ripetutamente corsia,F
"Il conducente di un veicolo, oltre a rispettare le norme specifiche della circolazione, deve tenere un rapporto corretto e tollerante verso gli altri utenti della strada",V
"Quando si avvicina ad un incrocio, il conducente deve sempre usare la massima prudenza, anche quando gli altri conducenti devono dargli la precedenza",V
Il conducente di un veicolo deve tutelare la propria e l'altrui sicurezza,V
Il conducente di un veicolo deve rispettare gli agenti del traffico e collaborare con essi,V
Il conducente di un veicolo deve cercare di prevedere il comportamento degli altri utenti,V
Il conducente di un veicolo deve essere paziente e tollerante anche in caso di rallentamento della circolazione,V
"Il conducente di un veicolo non deve fare sempre affidamento sul comportamento degli altri, che può non essere corretto",V
Il conducente di un veicolo non può pretendere di passare per primo quando sorge il dubbio che non gli venga concessa la precedenza,V
Il diritto di precedenza non autorizza il conducente ad attraversare l'incrocio senza usare prudenza,V
"Il conducente di un veicolo di grandi dimensioni ha, di norma, la precedenza sul conducente di un veicolo più piccolo",F
Il conducente di un veicolo può approfittare della potenza del proprio veicolo per non dare la precedenza a chi spetta,F
Il conducente di un veicolo pesante può tenere un comportamento che è causa di insofferenza negli altri,F
Il conducente di un veicolo deve rispettare gli agenti del traffico solo se sono in divisa,F
Il conducente di un veicolo può fare a meno di usare la massima prudenza quando si avvicina ad un incrocio in cui ha il diritto di precedenza,F
"Il conducente deve dare segni di impazienza, se il veicolo che sta davanti procede troppo lentamente",F
"Un incidente, anche a bassa velocità, potrebbe creare gravi problemi fisici a pedoni, ciclisti e motociclisti, se coinvolti",V
Bisogna controllare frequentemente nello specchietto retrovisore se sopraggiunge un ciclista o un motociclista,V
"Il conducente, dopo aver posteggiato il veicolo al lato della carreggiata, prima di aprire lo sportello deve controllare che non sopraggiungano ciclisti o motociclisti",V
I montanti interni degli autoveicoli condizionano la visibilità,V
I montanti interni degli autoveicoli riducono la possibilità di vedere un ciclista o un motociclista,V
Un incidente a bassa velocità non crea problemi di incolumità ai conducenti coinvolti,F
Il conducente che scende da un veicolo in sosta non deve controllare se sopraggiungono ciclisti,F
Nello specchietto retrovisore il conducente deve controllare solo se sopraggiungono autocarri o autobus,F
Il conducente di un motociclo può fare lo slalom tra i veicoli fermi al semaforo,F
Il conducente del motociclo può parcheggiare sul marciapiede anche se non vi sono appositi spazi di posteggio,F
Il conducente del motociclo può circolare sul marciapiede se il traffico sulla carreggiata è bloccato,F
Bisogna usare maggiore prudenza nei confronti delle persone diversamente abili,V
Bisogna usare maggiore prudenza nei confronti delle persone anziane,V
Bisogna usare maggiore prudenza nei confronti dei bambini che attraversano la strada,V
Bisogna usare maggiore prudenza nei confronti dei conducenti che dimostrano una guida incerta,V
Bisogna usare maggiore prudenza nei confronti dei conducenti di veicoli adattati per persone diversamente abili,V
Bisogna usare maggiore prudenza nei confronti delle persone in bicicletta e di quelle con scarsa capacità di movimento,V
Bisogna usare particolare prudenza nei confronti dei conducenti che hanno conseguito la patente di guida in uno Stato estero,F
Bisogna usare maggiore prudenza nei confronti dei conducenti di autoveicoli elettrici,F
Bisogna usare maggiore prudenza nei confronti dei conducenti di taxi,F
Bisogna usare maggiore prudenza nei confronti dei conducenti di tricicli a motore,F
"Bisogna usare maggiore prudenza nei confronti dei pedoni muniti di bastone bianco, ma non di quelli con bastone bianco-rosso",F
Quando le persone anziane attraversano la carreggiata bisogna tenere presente che potrebbero non fare adeguata attenzione ai veicoli,V
Quando le persone anziane attraversano la carreggiata bisogna tenere presente che potrebbero fermarsi improvvisamente al centro della strada,V
"Quando le persone anziane attraversano la carreggiata bisogna tenere presente che potrebbero non guardare né a destra, né a sinistra",V
"Quando le persone anziane attraversano la carreggiata bisogna tenere presente che, data la loro età, non reagiscono prontamente alle situazioni di pericolo",V
"Quando le persone anziane attraversano la carreggiata non bisogna avvicinarsi troppo con il veicolo, per evitare che si sentano minacciati e reagiscano con movimenti pericolosi",V
"Le persone anziane che attraversano la carreggiata sono esposte a maggiori pericoli, perché le loro capacità visive e uditive non sono più eccellenti",V
"Le persone anziane che attraversano la carreggiata sono esposte a maggiori pericoli, perché potrebbero valutare male la velocità dei veicoli che sopraggiungono",V
Quando le persone anziane attraversano la carreggiata bisogna tenere presente che hanno i riflessi più rapidi e quindi attraversano con più accortezza,F
"Quando le persone anziane attraversano la carreggiata bisogna tenere presente che, di solito, attraversano rapidamente e con prudenza",F
"Quando le persone anziane attraversano la carreggiata bisogna tenere presente che, avendo più esperienza e un campo visivo maggiore, intuiscono meglio le situazioni di pericolo",F
Quando le persone anziane attraversano la carreggiata bisogna lampeggiare e suonare il clacson per farle attraversare rapidamente,F
Quando le persone anziane attraversano la carreggiata bisogna dare la precedenza solo a coloro che attraversano da sinistra a destra,F
Il conducente deve fermarsi e dare la precedenza al pedone non vedente con il bastone bianco che si accinge ad attraversare la strada fuori dalle strisce pedonali,V
Il conducente deve fermarsi e facilitare l'attraversamento al pedone non vedente con il bastone bianco che attraversa la strada fuori dalle strisce pedonali,V
"Il conducente deve dare la precedenza al pedone non vedente con il bastone bianco che attraversa la strada fuori dalle strisce pedonali, anche se non è accompagnato da un cane guida",V
"Il conducente deve fermarsi per concedere la precedenza al pedone sordocieco che, con il bastone bianco-rosso, attraversa la strada fuori dalle strisce pedonali",V
"Il conducente deve dare la precedenza al pedone con il bastone bianco o bianco-rosso che attraversa la strada, anche se è fuori dalle strisce di un attraversamento pedonale",V
"Il conducente deve fermarsi quando un pedone non vedente con il bastone bianco si accinge ad attraversare la strada, evitando di frenare bruscamente per non spaventarlo",V
Il conducente deve accelerare per sgombrare rapidamente la carreggiata quando un pedone non vedente con il bastone bianco attraversa la strada senza cane guida,F
"Il conducente deve passare per primo, in quanto ha la precedenza, quando un pedone non vedente con il bastone bianco attraversa la strada fuori dalle strisce pedonali",F
"Il conducente, quando un pedone non vedente con il bastone bianco attraversa la strada fuori dalle strisce pedonali, deve dargli la precedenza solo se l'attraversamento pedonale dista oltre 100 metri",F
"Il conducente deve dare la precedenza a un pedone non vedente che attraversa la strada fuori dalle strisce pedonali, solo se munito di bastone bianco-rosso",F
Il conducente deve prevedere che un pedone non vedente con il bastone bianco che attraversa la strada fuori dalle strisce pedonali camminerà rapidamente e senza incertezza,F
"Se un pedone con bastone bianco attraversa la strada fuori dalle strisce pedonali, bisogna suonare il clacson per sollecitarlo ad attraversare rapidamente",F
"In vicinanza di un attraversamento pedonale, il conducente deve considerare che il pedone, nell'attraversare la strada, può diventare insicuro e ritornare improvvisamente indietro",V
"In vicinanza di un attraversamento pedonale, il conducente deve considerare che le persone anziane solitamente attraversano lentamente e con difficoltà",V
"In vicinanza di un attraversamento pedonale, il conducente deve considerare che le reazioni dei bambini che attraversano sono imprevedibili e, quindi, possono creare pericolo",V
"In vicinanza di un attraversamento pedonale, il conducente deve considerare che i bambini potrebbero avanzare sulle strisce, per poi tornare indietro improvvisamente, senza motivo apparente",V
"In vicinanza di un attraversamento pedonale, il conducente deve considerare che il pedone potrebbe fermarsi improvvisamente sulle strisce dell'attraversamento pedonale",V
"In vicinanza di un attraversamento pedonale, il conducente deve considerare che i pedoni, in special modo i bambini, possono sbucare all'improvviso tra i veicoli parcheggiati",V
"In vicinanza di un attraversamento pedonale, il conducente deve considerare che i veicoli parcheggiati in prossimità delle strisce impediscono la visuale dei pedoni",V
"In vicinanza di un attraversamento pedonale, il conducente deve aspettarsi dai bambini una reazione rapida e un comportamento corretto",F
"In vicinanza di un attraversamento pedonale, i pedoni devono fare un cenno con la mano prima di iniziare l'attraversamento",F
"In vicinanza di un attraversamento pedonale, il conducente deve considerare che un pedone munito di bastone bianco ha più esperienza su come attraversare la carreggiata",F
"In vicinanza di un attraversamento pedonale, il conducente deve arrestarsi se il pedone che attraversa è munito di bastone bianco-rosso; deve solo rallentare se, invece, è munito di bastone bianco",F
"In vicinanza di un attraversamento pedonale, il conducente deve accelerare quel tanto che basta per passare davanti al pedone che attraversa",F
"In vicinanza di un attraversamento pedonale, il conducente deve considerare che se il pedone si è fermato in mezzo alle strisce dell'attraversamento significa che ha rinunciato al suo diritto di passare",F
"In vicinanza di un attraversamento pedonale, il conducente deve considerare che i pedoni devono attraversare la strada affiancati, in modo da impiegare meno tempo",F
"Quando vi sono bambini fermi al semaforo bisogna usare prudenza, in quanto potrebbero attraversare improvvisamente la strada appena la luce del semaforo veicolare passa dal verde al giallo",V
"Quando vi sono bambini fermi al semaforo bisogna usare prudenza, in quanto potrebbero attraversare velocemente la strada anche con il rosso, ritenendo che duri troppo",V
"Quando vi sono bambini fermi al semaforo bisogna usare prudenza, perché può accadere che si spingano a vicenda, finendo sulla carreggiata",V
"Quando vi sono bambini fermi al semaforo bisogna usare prudenza, perché potrebbero scendere dal marciapiede, invadendo la carreggiata, quando ancora per loro il semaforo è disposto al rosso",V
"Prima di impegnare un incrocio, dopo che è scattata la luce verde del semaforo, il conducente deve attendere che i pedoni abbiano finito di attraversare la strada",V
"Quando vi sono bambini fermi al semaforo, bisogna tenere presente che possono attraversare la strada solo se accompagnati da un adulto",F
"I bambini, al semaforo, possono attraversare la strada solo dopo aver ricevuto un gesto di consenso da parte degli automobilisti",F
"Quando vi sono bambini fermi al semaforo, si può essere certi che attraversino la strada solo quando il semaforo pedonale abbia la luce verde accesa",F
"Quando vi sono bambini fermi al semaforo, si può essere certi che non attraverseranno la strada se il semaforo è a luce gialla lampeggiante",F
"Alla guida di un veicolo, in vicinanza di una piazzola di fermata di autobus che trasporta scolari, occorre fare attenzione ai bambini che potrebbero aver iniziato ad attraversare la carreggiata nascosti dall'autobus",V
"Alla guida di un veicolo, in vicinanza di una piazzola per la fermata di autobus per scolari, occorre fare attenzione ai bambini, che potrebbero attraversare di corsa la strada per salire sullo scuolabus",V
"Alla guida di un veicolo, in vicinanza di una piazzola di fermata di autobus per scolari, occorre prepararsi a frenare, nel caso in cui dei bambini attraversino improvvisamente la strada",V
"Alla guida di un veicolo, in vicinanza di una piazzola di fermata di autobus per scolari, occorre essere prudenti e tenere conto dei comportamenti imprevedibili dei bambini",V
"In vicinanza di una piazzola di fermata di autobus per scolari, può accadere che i bambini scendano dall'autobus senza fare attenzione ai veicoli che sopraggiungono",V
"Alla guida di un veicolo, in vicinanza di una piazzola di fermata di autobus per scolari, bisogna rallentare particolarmente se vi è lo scuolabus",V
"Alla guida di un veicolo, in vicinanza di una piazzola di fermata di autobus per scolari, non si deve rallentare, per evitare di ostacolare la circolazione degli altri veicoli",F
"Alla guida di un veicolo, in vicinanza di una piazzola di fermata di autobus per scolari, occorre passare per primi, avendo sempre la precedenza sui bambini che attraversano la strada",F
"Alla guida di un veicolo, in vicinanza di una piazzola di fermata di autobus per scolari, occorre suonare per invitare i bambini che attraversano sulle strisce a dare la precedenza",F
"Alla guida di un veicolo, in vicinanza di una piazzola di fermata di autobus per scolari, si deve rallentare solo se vi sono bambini che attraversano",F
"Alla guida di un veicolo, in vicinanza di una piazzola di fermata di autobus per scolari, occorre fare attenzione allo scuolabus, che dopo la fermata farà sicuramente retromarcia",F
"Alla guida di un veicolo, in vicinanza di una piazzola di fermata di autobus per scolari, non si può proseguire nella marcia se le portiere dello scuolabus sono ancora aperte",F
"Alla guida di un veicolo, in vicinanza di una piazzola di fermata di autobus per scolari, non è necessario rallentare se lo scuolabus è fermo",F
"Il conducente, in vicinanza di un posteggio riservato ai taxi, deve rallentare ed eventualmente fermarsi se vi sono pedoni che attraversano la strada, senza guardare",V
"Il conducente, in vicinanza di un posteggio riservato ai taxi, deve fare attenzione ai pedoni che salgono o scendono dal taxi",V
Il conducente di un veicolo diverso dai taxi non può sostare nei posteggi riservati ai taxi,V
"Il conducente, in vicinanza di un posteggio riservato ai taxi, deve fare attenzione ai pedoni, che possono attraversare improvvisamente la strada senza le dovute precauzioni",V
"Il conducente, in vicinanza di un posteggio riservato ai taxi, deve dare la precedenza ai taxi che s'immettono sulla strada",F
"Il conducente, in vicinanza di un posteggio riservato ai taxi, deve dare la precedenza ai taxi in partenza, qualora s'immettano dal lato sinistro della carreggiata",F
Il conducente di un veicolo diverso dai taxi può sostare nei posteggi riservati ai taxi dalle ore 20.00 alle ore 8.00,F
"Quando la carreggiata è occupata da ciclisti o pedoni, per sorpassarli è prudente mantenere un'adeguata distanza di sicurezza laterale",V
"Quando la carreggiata è occupata da ciclisti o pedoni, non è prudente sorpassarli se non si può rispettare una distanza laterale sufficiente.",V
"Quando la carreggiata extraurbana è occupata da ciclisti o pedoni, è consigliabile suonare il clacson prima di sorpassarli",V
Il conducente che intende sorpassare ciclisti o pedoni che occupano la carreggiata deve usare molta prudenza,V
"Poiché la marcia dei ciclisti a volte avviene con leggeri sbandamenti, il conducente di un veicolo deve tener conto di tale particolarità, in caso di sorpasso",V
Il conducente che intende sorpassare ciclisti o pedoni che occupano la carreggiata deve mantenere una distanza laterale di almeno 2 metri,F
E' vietato sorpassare ciclisti o pedoni che occupano la carreggiata,F
